{
    "StartChargeSeq": "MA01H3BQ1202011101428100001",
    "StartChargeSeqStat": 4,
    "ConnectorID": "20099_1",
    "ConnectorStatus": 3,
    "TotalPower": 0.021,
    "CurrentA": 7,
    "VoltageA": 397,
    "Soc": 30,
    "StartTime": "2020-11-10 14:28:12",
    "EndTime": "2020-11-10 14:29:11",
    "ChargeDetails": [
        {
            "DetailStartTime": "2020-11-10 14:28:12",
            "DetailEndTime": "2020-11-10 14:28:57",
            "ElecPrice": 0.78,
            "SevicePrice": 0.2,
            "DetailPower": 0.021,
            "DetailElecMoney": 0.16,
            "DetailSeviceMoney": 0.04
        }
    ]
}